<?xml version="1.0" encoding="UTF-8"?>
<!DOCTYPE AudioPlugin SYSTEM "AudioPluginDef.dtd">
<AudioPlugin Version="0.1">
	<Metadata>
		<Name>clamTestRtPlugin</Name>
		<Description>This is a test realtime audio plugin</Description>
		<Authors>Fulano, Sultano, Mengano</Authors>
		<Copyright Year="2010">Club de Audio FIUBA</Copyright>
		<License>GPL</License>
		<!-- <UID>1400</UID> Comment: Unique ID is not needed in clam's plugins -->
		<Category>Plugins</Category>
	</Metadata>

	<!--TODO: Considerar agregar un Realtime=True/False. Para que podrÃ­a servir. Alcanza con que este implicito en el tipo de standard? -->

	<Inputs>
		<Port Name="L Input">AudioInPort</Port>
		<Port Name="R Input">AudioInPort</Port>

		<Control Name="Gain" Min="0." Max="1.0" DefaultValue=".5">FloatInControl</Control>
	</Inputs>
	<Outputs>
		<Port Name="L Output">AudioOutPort</Port>
		<Port Name="R Output">AudioOutPort</Port>
	</Outputs>

	<OutputPlugin Standard="CLAM" BuildSystem="Scons" OS="Linux">
		<BaseTemplateName>Default</BaseTemplateName>

		<CLAM_DefaultConfig> <!--  CLAM plugin specific configuration -->
			<BaseClass>Processing</BaseClass>
			<WithConfig>True</WithConfig>
			<clam_prefix>~/dev/local/clam_dev</clam_prefix> <!-- optional -->
		</CLAM_DefaultConfig>

	<!--VST plugin specific configuration example
		<VST_DefaultConfig> 
			<vst_prefix>~/dev/local/vst_sdk</vst_prefix>
		</VST_DefaultConfig>
	-->
	</OutputPlugin>
</AudioPlugin>
