<?xml version="1.0" encoding="UTF-8"?>
<!DOCTYPE AudioPlugin SYSTEM "AudioPluginDef.dtd">
<AudioPlugin Version="0.1">
	<Metadata>
		<Name>vstTestRtPlugin</Name>
		<Description>This is a test realtime audio plugin</Description>
		<Authors>Fulano, Sultano, Mengano</Authors>
		<Copyright Year="2010">Club de Audio FIUBA</Copyright>
		<License>GPL</License>
		<UID>APTestRtPlugin</UID>
		<Category>kPlugCategEffect</Category>  <!-- Simple Effect -->
	</Metadata>

	<Inputs>
		<Port Name="L Input">AudioInPort</Port>
		<Port Name="R Input">AudioInPort</Port>

		<Control Name="Gain" Min="0." Max="1.0" DefaultValue=".5">Float</Control>
	</Inputs>
	<Outputs>
		<Port Name="L Output">AudioOutPort</Port>
		<Port Name="R Output">AudioOutPort</Port>
	</Outputs>

	<OutputPlugin Standard="VST" BuildSystem="Scons" OS="Linux">
		<BaseTemplateName>Default</BaseTemplateName>

		<!--VST plugin specific configuration example -->
			<!--TODO: add Vendor? or take Copyright value? -->
		<VST_DefaultConfig> 
			<vst_prefix>~/dev/local/vst_sdk</vst_prefix>
		</VST_DefaultConfig>

	</OutputPlugin>
</AudioPlugin>
