<?xml version="1.0" encoding="UTF-8"?>
<!DOCTYPE AudioPlugin SYSTEM "AudioPluginDef.dtd">
<AudioPlugin Version="0.1">
	<Metadata>
		<Name>ladspaTestRtPlugin</Name>
		<Description>This is a test realtime audio plugin</Description>
		<Authors>Fulano, Sultano, Mengano</Authors>
		<Copyright Year="2010">Club de Audio FIUBA</Copyright>
		<License>GPL</License>
		<UID>1400</UID> <!-- LADSPA Unique ID -->

		<!-- <Category>Plugins</Category> -->

	</Metadata>

	<Inputs>
		<Port Name="L Input">AudioInPort</Port>
		<Port Name="R Input">AudioInPort</Port>

		<Control Name="Distortion" Min="0." Max="1.0" DefaultValue=".5">Data</Control>
	</Inputs>
	<Outputs>
		<Port Name="L Output">AudioOutPort</Port>
		<Port Name="R Output">AudioOutPort</Port>
	</Outputs>

	<OutputPlugin Standard="LADSPA" BuildSystem="Makefile" OS="Linux">
		<BaseTemplateName>Default</BaseTemplateName>

		<LADSPA_DefaultConfig> <!--  LADSPA plugin specific configuration -->
		</LADSPA_DefaultConfig>

	</OutputPlugin>
</AudioPlugin>
