<?xml version="1.0" encoding="UTF-8"?>
<!DOCTYPE AudioPlugin SYSTEM "AudioPluginDef.dtd">
<AudioPlugin Version="0.1">
	<Metadata>
		<Name>vstMIDITestPlugin</Name>
		<Description>This is a test plugin</Description>
		<Authors>Fulano, Sultano, Mengano</Authors>
		<Copyright Year="2010">Club de Audio FIUBA</Copyright>
		<License>GPL</License>
		<Library>Test</Library>
		<UID>1000</UID>
		<Category>Effect</Category>
	</Metadata>

	<Inputs>
		<Port Name="L Input">AudioInPort</Port>
		<Port Name="R Input">AudioInPort</Port>

		<Control Name="Gain" Min="0." Max="1.0" DefaultValue=".5">Float</Control>
	</Inputs>
	<Outputs>
		<Port Name="L Output">AudioOutPort</Port>
		<Port Name="R Output">AudioOutPort</Port>
	</Outputs>

	<OutputPlugin Standard="VST" BuildSystem="Makefile" OS="Linux">
		<BaseTemplateName>CrossCompiledMIDI</BaseTemplateName>

		<!--VST plugin specific configuration example -->
		<VST_DefaultConfig> 
			<vst_prefix>$(HOME)/dev/audio/vst/vstsdk2.4</vst_prefix>
		</VST_DefaultConfig>
	</OutputPlugin>
</AudioPlugin>
