<?xml version="1.0" encoding="UTF-8"?>
<!DOCTYPE AudioPlugin SYSTEM "AudioPluginDef.dtd">
<AudioPlugin Version="0.1">
	<Metadata>
		<Name>vst_w64_TestRtPlugin</Name>
		<Description>This is a test plugin</Description>
		<Authors>hordia</Authors>
		<Copyright Year="2017">hordia</Copyright>
		<License>GPL</License>
		<Library>Test</Library>
		<UID>1000</UID>
		<Category>Effect</Category>  <!-- Simple Effect -->
	</Metadata>

	<Inputs>
		<Port Name="L Input">AudioInPort</Port>
		<Port Name="R Input">AudioInPort</Port>

		<Control Name="Gain" Min="0." Max="1.0" DefaultValue=".5">Float</Control>
	</Inputs>
	<Outputs>
		<Port Name="L Output">AudioOutPort</Port>
		<Port Name="R Output">AudioOutPort</Port>
	</Outputs>

	<OutputPlugin Standard="VST" BuildSystem="Makefile" OS="Linux">
		<BaseTemplateName>CrossCompiled_w64</BaseTemplateName>

		<!--VST plugin specific configuration example -->
			<!--TODO: add Vendor? or take Copyright value? -->
		<VST_DefaultConfig> 
			<vst_prefix>$(HOME)/dev/audio/vst/vstsdk2.4</vst_prefix>
		</VST_DefaultConfig>

	</OutputPlugin>
</AudioPlugin>
